"ItemTitle","IMDBid","Rating","Rated.Date","Title","Year","Rated","Released","Runtime","Genre","Director","Writer","Actors","Plot","Language","Country","Awards","Poster","Metascore","imdbRating","imdbVotes","imdbID","Type","DVD","BoxOffice","Production","Website","totalSeasons","Internet Movie Database","Metacritic","Rotten Tomatoes","Rated.Year"
"Sleepers","tt0117665",5,2023-02-16,"Sleepers","1996","R",1996,"147 min","Crime, Drama, Thriller","Barry Levinson","Lorenzo Carcaterra, Barry Levinson","Robert De Niro, Kevin Bacon, Brad Pitt","After a prank goes disastrously wrong, a group of boys are sent to a detention center where they are brutalized. Thirteen years later, an unexpected random encounter with a former guard gives them a chance for revenge.","English","United States","Nominated for 1 Oscar. 1 win & 5 nominations total","https://m.media-amazon.com/images/M/MV5BMzk1MmI4NzAtOGRiNS00YjY1LTllNmEtZDhiZDM4MjU2NTMxXkEyXkFqcGdeQXVyNjc3MjQzNTI@._V1_SX300.jpg","49","7.5",NA,"tt0117665","movie","03 Nov 2009","$53,315,285","N/A","N/A",NA,"7.5/10","49/100","73%",2023.47
"Samurai Pizza Cats","tt0122834",4,2023-02-11,"Samurai Pizza Cats","1990–1991","TV-Y7",1996,"30 min","Animation, Action, Comedy","N/A","N/A","Walter Massey, Dean Hagopian, Rick Jones","The feline staff of a pizza joint fight crime as superheroes when called for.","English","France","N/A","https://m.media-amazon.com/images/M/MV5BZjhkZTZhMGMtYzdjZC00Yzc0LWEyYjgtZGJkNDI3MDBhYzllXkEyXkFqcGdeQXVyNTk5ODg4NDA@._V1_SX300.jpg","N/A","7.3",NA,"tt0122834","series",NA,NA,NA,NA,"1","7.3/10",NA,NA,2023.42
"King Kong","tt0360717",5,2023-02-11,"King Kong","2005","PG-13",2005,"187 min","Action, Adventure, Drama","Peter Jackson","Fran Walsh, Philippa Boyens, Peter Jackson","Naomi Watts, Jack Black, Adrien Brody","A greedy film producer assembles a team of moviemakers and sets out for the infamous Skull Island, where they find more than just cannibalistic natives.","English","United States, New Zealand, Germany","Won 3 Oscars. 46 wins & 104 nominations total","https://m.media-amazon.com/images/M/MV5BMjYxYmRlZWYtMzAwNC00MDA1LWJjNTItOTBjMzlhNGMzYzk3XkEyXkFqcGdeQXVyMTQxNzMzNDI@._V1_SX300.jpg","81","7.2",NA,"tt0360717","movie","28 Mar 2006","$218,080,025","N/A","N/A",NA,"7.2/10","81/100","84%",2023.42
"The Midnight Sky","tt10539608",3,2023-02-11,"The Midnight Sky","2020","PG-13",2020,"118 min","Adventure, Drama, Sci-Fi","George Clooney","Lily Brooks-Dalton, Mark L. Smith","George Clooney, Felicity Jones, David Oyelowo","This post-apocalyptic tale follows Augustine, a lonely scientist in the Arctic, as he races to stop Sully and her fellow astronauts from returning home to a mysterious global catastrophe.","English","United States","Nominated for 1 Oscar. 5 wins & 46 nominations total","https://m.media-amazon.com/images/M/MV5BNDQwYjJjODMtOWNmNC00NDJjLThiNDgtNzVkOTM1MjY5NDQ5XkEyXkFqcGdeQXVyMTEyMjM2NDc2._V1_SX300.jpg","58","5.6",NA,"tt10539608","movie","23 Dec 2020","N/A","N/A","N/A",NA,"5.6/10","58/100","49%",2023.42
"Knock at the Cabin","tt15679400",6,2023-02-03,"Knock at the Cabin","2023","R",2023,"100 min","Horror, Mystery, Thriller","M. Night Shyamalan","M. Night Shyamalan, Steve Desmond, Michael Sherman","Dave Bautista, Jonathan Groff, Ben Aldridge","While vacationing, a girl and her parents are taken hostage by armed strangers who demand that the family make a choice to avert the apocalypse.","English","United States","N/A","https://m.media-amazon.com/images/M/MV5BZTc4MjU0MjMtYTEwNy00YjNlLTk2MGYtMjNlNzFjMmY4MjQ0XkEyXkFqcGdeQXVyODk4OTc3MTY@._V1_SX300.jpg","N/A","N/A",NA,"tt15679400","movie","N/A","N/A","N/A","N/A",NA,NA,NA,"68%",2023.34
"The Wandering Earth II","tt13539646",6,2023-01-26,"The Wandering Earth II","2023","N/A",2023,"173 min","Action, Adventure, Drama","Frant Gwo","Yang Zhixue, Gong Geer, Frant Gwo","Andy Lau, Zina Blahusova, Jing Wu","Humans built huge engines on the surface of the earth to find a new home. But the road to the universe is perilous. In order to save earth, young people once again have to step forward to start a race against time for life and death.","Mandarin, Russian, English, Hindi, French, Japanese, Shanghainese","China","N/A","https://m.media-amazon.com/images/M/MV5BN2IzY2E2MTQtNTMxMy00YTJjLTkzYTEtYzAyM2VlYjFjZDQzXkEyXkFqcGdeQXVyMTI5ODA1OTU0._V1_SX300.jpg","56","8.0",NA,"tt13539646","movie","N/A","N/A","N/A","N/A",NA,"8.0/10","56/100",NA,2023.26
