"ItemTitle","IMDBid","Rating","Rated.Date","Title","Year","Rated","Released","Runtime","Genre","Director","Writer","Actors","Plot","Language","Country","Awards","Poster","Metascore","imdbRating","imdbVotes","imdbID","Type","DVD","BoxOffice","Production","Website","Season","Episode","seriesID","Internet Movie Database","Metacritic","Rotten Tomatoes","Rated.Year"
"Living","tt9051908",9,2023-01-14,"Living","2022","PG-13",2022,"102 min","Drama","Oliver Hermanus","Kazuo Ishiguro, Akira Kurosawa","Bill Nighy, Aimee Lou Wood, Alex Sharp","In 1950s London, a humorless civil servant decides to take time off work to experience life after receiving a grim diagnosis.","English","United Kingdom, Japan","6 wins & 19 nominations","https://m.media-amazon.com/images/M/MV5BNTdiMWI1ZmUtOTk3OS00ZDYxLThjZWYtYjIwNWJkNTkxMmJlXkEyXkFqcGdeQXVyMTQyODg5MjQw._V1_SX300.jpg","80","7.6",NA,"tt9051908","movie","N/A","N/A","N/A","N/A",NA,NA,NA,"7.6/10","80/100","94%",2023.14
"Broker","tt13056052",7,2023-01-14,"Broker","2022","R",2022,"129 min","Drama","Hirokazu Koreeda","Hirokazu Koreeda","Song Kang-ho, Dong-won Gang, Bae Doona","Boxes that are left out for people to anonymously drop off their unwanted babies.","Korean","South Korea","9 wins & 22 nominations","https://m.media-amazon.com/images/M/MV5BY2UxOTEwOGUtYmFmOS00NTc4LWI0MWMtNGJkZGViY2EwZTgyXkEyXkFqcGdeQXVyNDY5NTQyMDU@._V1_SX300.jpg","74","7.1",NA,"tt13056052","movie","N/A","N/A","N/A","N/A",NA,NA,NA,"7.1/10","74/100","88%",2023.14
"Terms of Endearment","tt0086425",9,2023-01-12,"Terms of Endearment","1983","PG",1983,"132 min","Comedy, Drama","James L. Brooks","Larry McMurtry, James L. Brooks","Shirley MacLaine, Debra Winger, Jack Nicholson","Follows hard-to-please Aurora looking for love, and her daughter's family problems.","English","United States","Won 5 Oscars. 32 wins & 18 nominations total","https://m.media-amazon.com/images/M/MV5BMTk0ODM4NDk0MF5BMl5BanBnXkFtZTgwMTEzMDUxMDE@._V1_SX300.jpg","79","7.4",NA,"tt0086425","movie","10 Apr 2001","$108,423,489","N/A","N/A",NA,NA,NA,"7.4/10","79/100","81%",2023.12
"Corsage","tt11992694",8,2023-01-11,"Corsage","2022","N/A",2022,"113 min","Biography, Drama, History","Marie Kreutzer","Marie Kreutzer","Vicky Krieps, Colin Morgan, Tamás Lengyel","A fictional account of one year in the life of Empress Elisabeth of Austria. On Christmas Eve 1877, Elisabeth, once idolized for her beauty, turns 40 and is officially deemed an old woman; she starts trying to maintain her public ...","German, French, English, Hungarian, Italian","Austria, Luxembourg, Germany, France","7 wins & 24 nominations","https://m.media-amazon.com/images/M/MV5BYTBhZDIzYzMtYTg0Ni00NjJlLTk0NDItMTIxOTI1YTMyNzZkXkEyXkFqcGdeQXVyMTE1MzI2NzIz._V1_SX300.jpg","83","6.7",NA,"tt11992694","movie","N/A","N/A","N/A","N/A",NA,NA,NA,"6.7/10","83/100","88%",2023.11
"M3GAN","tt8760708",6,2023-01-10,"M3gan","2022","PG-13",2023,"102 min","Horror, Sci-Fi, Thriller","Gerard Johnstone","Akela Cooper, James Wan","Violet McGraw, Amie Donald, Jenna Davis","A robotics engineer at a toy company builds a life-like doll that begins to take on a life of its own.","English","United States","N/A","https://m.media-amazon.com/images/M/MV5BMDk4MTdhYzEtODk3OS00ZDBjLWFhNTQtMDI2ODdjNzQzZTA3XkEyXkFqcGdeQXVyMjMxOTE0ODA@._V1_SX300.jpg","N/A","6.0",503,"tt8760708","movie","N/A","N/A","N/A","N/A",NA,NA,NA,"6.0/10",NA,"94%",2023.1
"The Jazz Singer","tt0018037",4,2023-01-09,"The Jazz Singer","1927","Passed",1928,"88 min","Drama, Music, Musical","Alan Crosland","Samson Raphaelson, Alfred A. Cohn, Jack Jarmuth","Al Jolson, May McAvoy, Warner Oland","The son of a Jewish Cantor must defy the traditions of his religious father in order to pursue his dream of becoming a jazz singer.","English","United States","Nominated for 1 Oscar. 4 wins & 1 nomination total","https://m.media-amazon.com/images/M/MV5BOTUxNTk0MjEtZjQ5Yi00ODBhLTlkY2YtMDJhOWZmNDM1YWJkXkEyXkFqcGdeQXVyNjE5MjUyOTM@._V1_SX300.jpg","66","6.4",NA,"tt0018037","movie","16 Oct 2007","N/A","N/A","N/A",NA,NA,NA,"6.4/10","66/100","78%",2023.9
