"ItemTitle","IMDBid","Rating","Rated.Date","Title","Year","Rated","Released","Runtime","Genre","Director","Writer","Actors","Plot","Language","Country","Awards","Poster","Metascore","imdbRating","imdbVotes","imdbID","Type","DVD","BoxOffice","Production","Website","Internet Movie Database","Metacritic","Rotten Tomatoes","Rated.Year"
"Watu Wote: All of Us","tt6333422",7,2023-03-08,"Watu Wote: All of us","2017","Not Rated",NA,"22 min","Short, Drama","Katja Benrath","Julia Drache, Alexander Ikawah, Brian Munene","Adelyne Wairimu, Abdiwali Farrah, Barkhad Abdirahman","For a decade Kenya has been targeted by terrorist attacks of the Al-Shabaab. An atmosphere of anxiety and mistrust between Muslims and Christians is growing. Until in December 2015, Muslim bus passengers showed that solidarity can...","Swahili, Somali","Germany, Kenya","Nominated for 1 Oscar. 36 wins & 3 nominations total","https://m.media-amazon.com/images/M/MV5BMTI2MTQ5MmQtNGFiNS00YWQzLWJmYjQtMTk4NWJhM2U1NTAzXkEyXkFqcGdeQXVyMjY4ODk4MDQ@._V1_SX300.jpg","N/A","7.4",869,"tt6333422","movie","10 Mar 2018","N/A","N/A","N/A","7.4/10",NA,"100%",2023.67
"The Eleven O'Clock","tt6023474",7,2023-03-08,"The Eleven O'Clock","2016","Not Rated",2016,"13 min","Short, Comedy","Derin Seale","Josh Lawson","Josh Lawson, Damon Herriman, Jessica Wren","The delusional patient of a psychiatrist believes he is actually the psychiatrist. As they each attempt to treat each other the session gets out of control.","English","Australia","Nominated for 1 Oscar. 5 wins & 1 nomination total","https://m.media-amazon.com/images/M/MV5BMzM5MjZlOTItZGZlNy00ZjRjLWFhMTctYmIxYzUwMDM0OTg4XkEyXkFqcGdeQXVyMjkxODY1OTI@._V1_SX300.jpg","N/A","7.6",NA,"tt6023474","movie","N/A","N/A","N/A","N/A","7.6/10",NA,NA,2023.67
"My Nephew Emmett","tt6598290",6,2023-03-08,"My Nephew Emmett","2017","Not Rated",2017,"20 min","Short, Drama, History","Kevin Wilson Jr.","Kevin Wilson Jr.","L.B. Williams, Joshua Wright, Dane Rhodes","At 2:30AM on August 28, 1955 in the most racially divided state in the country, 64 year-old Mose Wright tries to protect his 14 year-old nephew Emmett Till from two racist killers out for blood. Based on the true story of the 1955...","English","United States","Nominated for 1 Oscar. 5 wins & 1 nomination total","https://m.media-amazon.com/images/M/MV5BMmIxZmE1MDgtZmRlMS00YTZjLWFiOGMtMzBiZjZmMGQ5NGZlXkEyXkFqcGdeQXVyNTk5NTQzNDI@._V1_SX300.jpg","N/A","6.8",731,"tt6598290","movie","09 Mar 2018","N/A","N/A","N/A","6.8/10",NA,"91%",2023.67
"The Silent Child","tt6186970",8,2023-03-08,"The Silent Child","2017","Not Rated",2017,"20 min","Short, Drama","Chris Overton","Rachel Shenton","Rachel Fielding, Philip York, Rachel Shenton","A deaf 6-year-old girl named Libby lives in a world of silence until a caring social worker teaches her to use sign language to communicate.","English, British Sign ","United Kingdom","Won 1 Oscar. 25 wins & 8 nominations total","https://m.media-amazon.com/images/M/MV5BZTk4YzAzM2MtMGVjOS00Y2M5LTk1YTItZGM2ZmYwZTI1YzM0XkEyXkFqcGdeQXVyNjc3OTI2MTM@._V1_SX300.jpg","N/A","7.7",NA,"tt6186970","movie","04 Mar 2018","N/A","N/A","N/A","7.7/10",NA,"92%",2023.67
"DeKalb Elementary","tt5926890",9,2023-03-08,"DeKalb Elementary","2017","N/A",2017,"21 min","Short, Drama","Reed Van Dyk","Reed Van Dyk","Shinelle Azoroh, John Brockus, Michael Brown","Inspired by an actual 911 call placed during a school shooting incident in Atlanta, Georgia.","English","United States","Nominated for 1 Oscar. 11 wins & 5 nominations total","https://m.media-amazon.com/images/M/MV5BMDI0NzU2MmItZTI5OS00OWJhLWJlNWMtNzFmNjdiZTNjYjk1XkEyXkFqcGdeQXVyMTQ4MTc4OTM@._V1_SX300.jpg","N/A","7.5",961,"tt5926890","movie","02 Mar 2018","N/A","N/A","N/A","7.5/10",NA,"92%",2023.67
"Dear Basketball","tt6794476",6,2023-03-08,"Dear Basketball","2017","Not Rated",2017,"6 min","Animation, Short, Biography","Glen Keane","Kobe Bryant","Kobe Bryant","An animated telling of Kobe Bryant's poem 'Dear Basketball'.","English","United States","Won 1 Oscar. 7 wins & 3 nominations total","https://m.media-amazon.com/images/M/MV5BOWExOTc5MmEtOGE0OC00ODVmLWExOWEtNDQzM2NiZDViYWI0XkEyXkFqcGdeQXVyODMzMDE2MjY@._V1_SX300.jpg","N/A","7.3",NA,"tt6794476","movie","N/A","N/A","N/A","N/A","7.3/10",NA,"69%",2023.67
"The Long Goodbye","tt0070334",9,2023-03-08,"The Long Goodbye","1973","R",1973,"112 min","Comedy, Crime, Drama","Robert Altman","Leigh Brackett, Raymond Chandler","Elliott Gould, Nina van Pallandt, Sterling Hayden","Private investigator Philip Marlowe helps a friend out of a jam, but in doing so gets implicated in his wife's murder.","English, Spanish","United States","2 wins & 1 nomination","https://m.media-amazon.com/images/M/MV5BN2RkZDljODgtMzRjZS00NTg1LTkxNmQtMWE2YWVjZjdhZDg0XkEyXkFqcGdeQXVyMjUzOTY1NTc@._V1_SX300.jpg","87","7.6",NA,"tt0070334","movie","02 Dec 2014","N/A","United Artists","N/A","7.6/10","87/100","95%",2023.67
