"ItemTitle","IMDBid","Rating","Rated.Date","Title","Year","Rated","Released","Runtime","Genre","Director","Writer","Actors","Plot","Language","Country","Awards","Poster","Metascore","imdbRating","imdbVotes","imdbID","Type","DVD","BoxOffice","Production","Website","totalSeasons","Internet Movie Database","Metacritic","Rotten Tomatoes","Rated.Year"
"The World of Apu","tt0052572",10,2023-05-16,"The World of Apu","1959","Not Rated",1960,"105 min","Drama","Satyajit Ray","Bibhutibhushan Bandyopadhyay, Satyajit Ray","Soumitra Chatterjee, Sharmila Tagore, Alok Chakravarty","This final installment in Satyajit Ray's Apu Trilogy follows Apu's life as an orphaned adult aspiring to be a writer.","Bengali","India","Nominated for 1 BAFTA Award5 wins & 3 nominations total","https://m.media-amazon.com/images/M/MV5BN2ZhM2NkZDUtMTI3OC00NWE5LWEwYzMtZTlhMjhkZGFlMjQyXkEyXkFqcGdeQXVyNTgyNTA4MjM@._V1_SX300.jpg","N/A","8.5",NA,"tt0052572","movie","17 Nov 2015","$134,241","N/A","N/A",NA,"8.5/10",NA,"96%",2023.136
"Sergeant York","tt0034167",6,2023-05-16,"Sergeant York","1941","Passed",1941,"134 min","Biography, Drama, History","Howard Hawks","Abem Finkel, Harry Chandlee, Howard Koch","Gary Cooper, Walter Brennan, Joan Leslie","A Tennessee farmer and marksman is drafted in World War I, and struggles with his pacifist inclinations before becoming one of the most celebrated war heroes.","English, French, German","United States","Won 2 Oscars. 5 wins & 10 nominations total","https://m.media-amazon.com/images/M/MV5BYmEzN2M4YjgtZmQ2MC00ZGI3LWEwNWEtNDRjNGE0N2FiMzQzXkEyXkFqcGdeQXVyNjc1NTYyMjg@._V1_SX300.jpg","N/A","7.7",NA,"tt0034167","movie","07 Nov 2006","$16,361,885","N/A","N/A",NA,"7.7/10",NA,"88%",2023.136
"BlackBerry","tt21867434",8,2023-05-16,"BlackBerry","2023","R",2023,"122 min","Biography, Comedy, Drama","Matt Johnson","Matt Johnson, Jacquie McNish, Matthew Miller","Jay Baruchel, Glenn Howerton, Matt Johnson","The story of the meteoric rise and catastrophic demise of the world's first smartphone.","English","Canada","1 win & 2 nominations","https://m.media-amazon.com/images/M/MV5BOTFlNDljMDctMjgyZi00NjIwLWIzOWEtMDMxNmI3OTBjMGVhXkEyXkFqcGdeQXVyODk4OTc3MTY@._V1_SX300.jpg","83","7.7",259,"tt21867434","movie","N/A","N/A","N/A","N/A",NA,"7.7/10","83/100",NA,2023.136
"R.M.N.","tt18550182",8,2023-05-16,"R.M.N.","2022","N/A",2023,"125 min","Drama","Cristian Mungiu","Cristian Mungiu","Marin Grigore, Judith State, Macrina Barladeanu","A non-judgmental analysis of the driving forces of human behavior when confronted with the unknown, of the way we perceive the other and on how we relate to an unsettling future.","Romanian, Hungarian, German, English, French, Sinhala","Romania, France, Belgium, Sweden","3 wins & 8 nominations","https://m.media-amazon.com/images/M/MV5BN2VkNjg0NjUtNTI5OC00NmQ2LThhMzgtYjA4MGMxYzQ2MGUzXkEyXkFqcGdeQXVyODA0MjgyNzM@._V1_SX300.jpg","80","7.4",NA,"tt18550182","movie","N/A","N/A","N/A","N/A",NA,"7.4/10","80/100","94%",2023.136
"Mirai","tt6900448",8,2023-05-14,"Mirai","2018","PG",2018,"98 min","Animation, Adventure, Drama","Mamoru Hosoda","Mamoru Hosoda","Rebecca Hall, John Cho, Daniel Dae Kim","A young boy encounters a magical garden which enables him to travel through time and meet his relatives from different eras, with guidance by his younger sister from the future.","Japanese, English","Japan","Nominated for 1 Oscar. 5 wins & 36 nominations total","https://m.media-amazon.com/images/M/MV5BZTJiZGE0OGYtMzRhMi00ZTJjLTgwYTItN2JlMWZkYjJlMjkzXkEyXkFqcGdeQXVyMTMxODk2OTU@._V1_SX300.jpg","81","7.0",NA,"tt6900448","movie","09 Apr 2019","$812,794","N/A","N/A",NA,"7.0/10","81/100","91%",2023.134
"Jimmy Neutron: Boy Genius","tt0268397",5,2023-05-14,"Jimmy Neutron: Boy Genius","2001","G",2001,"82 min","Animation, Action, Adventure","John A. Davis","John A. Davis, David N. Weiss, J. David Stem","Debi Derryberry, Rob Paulsen, Megan Cavanagh","An eight-year-old boy genius and his friends must rescue their parents after the adults are abducted by aliens.","English","United States, Australia","Nominated for 1 Oscar. 6 nominations total","https://m.media-amazon.com/images/M/MV5BMzczYzM4MmMtMTEyYi00ZGRmLWE2OTMtZmNhYTdiYjQ4NDUxXkEyXkFqcGdeQXVyMTMxMTY0OTQ@._V1_SX300.jpg","65","6.0",NA,"tt0268397","movie","02 Jul 2002","$80,936,232","N/A","N/A",NA,"6.0/10","65/100","74%",2023.134
