"ItemTitle","IMDBid","Rating","Rated.Date","Title","Year","Rated","Released","Runtime","Genre","Director","Writer","Actors","Plot","Language","Country","Awards","Poster","Metascore","imdbRating","imdbVotes","imdbID","Type","DVD","BoxOffice","Production","Website","totalSeasons","Season","Episode","seriesID","Internet Movie Database","Metacritic","Rotten Tomatoes","Rated.Year"
"Silence","tt0490215",7,2023-01-06,"Silence","2016","R",2017,"161 min","Drama, History","Martin Scorsese","Jay Cocks, Martin Scorsese, Shûsaku Endô","Andrew Garfield, Adam Driver, Liam Neeson","In the 17th century, two Portuguese Jesuit priests travel to Japan in an attempt to locate their mentor, who is rumored to have committed apostasy, and to propagate Catholicism.","English, Japanese, Latin","United States, United Kingdom, Taiwan, Japan, Mexico, Italy","Nominated for 1 Oscar. 6 wins & 58 nominations total","https://m.media-amazon.com/images/M/MV5BMjY3OTk0NjA2NV5BMl5BanBnXkFtZTgwNTg3Mjc2MDI@._V1_SX300.jpg","79","7.1",NA,"tt0490215","movie","28 Mar 2017","$7,100,177","N/A","N/A",NA,NA,NA,NA,"7.1/10","79/100","83%",2023.6
"Ghosts","tt8594324",8,2023-01-04,"Ghosts","2019–","TV-14",2020,"41S min","Comedy, Fantasy","N/A","Laurence Rickard, Mathew Baynton, Jim Howick","Lolly Adefope, Mathew Baynton, Simon Farnaby","A group of spirits restlessly squabble in an abandoned country home. To their despair, a young couple inherit the house with hopeful plans to renovate it into a luxury hotel.","English","United Kingdom","Nominated for 1 BAFTA Award8 nominations total","https://m.media-amazon.com/images/M/MV5BZWQyYmE4MGItOWZjNy00OTQxLWE2MDYtNDY4ZmEwY2M4YzQ4XkEyXkFqcGdeQXVyMjExMjk0ODk@._V1_SX300.jpg","N/A","8.3",NA,"tt8594324","series",NA,NA,NA,NA,"N/A",NA,NA,NA,"8.3/10",NA,NA,2023.4
"Lady Chatterley's Lover","tt14369780",6,2023-01-03,"Lady Chatterley's Lover","2022","R",2022,"126 min","Drama, Romance","Laure de Clermont-Tonnerre","David Magee, D.H. Lawrence","Emma Corrin, Jack O'Connell, Matthew Duckett","An unhappily married aristocrat begins a torrid affair with the gamekeeper on her husband's country estate.","English","United Kingdom, United States","1 nomination","https://m.media-amazon.com/images/M/MV5BMGQwYjY1YWUtN2FjMS00MzYxLWEyNDYtYzdlZWJhZTI5M2NhXkEyXkFqcGdeQXVyMTQ4NjQyMzE@._V1_SX300.jpg","67","7.0",NA,"tt14369780","movie","02 Dec 2022","N/A","N/A","N/A",NA,NA,NA,NA,"7.0/10","67/100","87%",2023.3
"Touch of Evil","tt0052311",9,2023-01-02,"Touch of Evil","1958","PG-13",1958,"95 min","Crime, Drama, Film-Noir","Orson Welles","Orson Welles, Whit Masterson, Franklin Coen","Charlton Heston, Orson Welles, Janet Leigh","A stark, perverse story of murder, kidnapping, and police corruption in a Mexican border town.","English, Spanish","United States","8 wins & 2 nominations","https://m.media-amazon.com/images/M/MV5BOTA1MjA3M2EtMmJjZS00OWViLTkwMTEtM2E5ZDk0NTAyNGJiXkEyXkFqcGdeQXVyNzkwMjQ5NzM@._V1_SX300.jpg","99","8.0",NA,"tt0052311","movie","06 Jul 2004","$2,247,465","N/A","N/A",NA,NA,NA,NA,"8.0/10","99/100","95%",2023.2
"Never Say Goodbye","tt0049547",6,2023-01-01,"Never Say Goodbye","1956","Approved",1956,"96 min","Drama, Romance","Jerry Hopper, Douglas Sirk","Luigi Pirandello, Bruce Manning, John D. Klorer","Rock Hudson, Cornell Borchers, George Sanders","In 1945 Vienna, an American doctor marries an Austrian girl, who later disappears in the Soviet Control Zone during a visit there, forcing everyone to presume her dead.","English","United States","N/A","https://m.media-amazon.com/images/M/MV5BNWMzOWE3ZTktMjE0Ny00OTZjLTgyNjgtZmQxN2I2ZmRmYWVmXkEyXkFqcGdeQXVyNjc1NTYyMjg@._V1_SX300.jpg","N/A","6.1",637,"tt0049547","movie","30 Oct 2015","$1,600,000","N/A","N/A",NA,NA,NA,NA,"6.1/10",NA,NA,2023.1
"Instead of Abracadabra","tt1351684",6,2022-12-31,"Instead of Abracadabra","2008","N/A",2010,"22 min","Short, Action, Comedy","Patrik Eklund","Patrik Eklund","Simon J. Berger, Jacob Nordenson, Anki Larsson","A man who still lives with his parents tries to realize his dream of becoming a magician.","Swedish","Sweden","Nominated for 1 Oscar. 2 wins & 4 nominations total","https://m.media-amazon.com/images/M/MV5BMTUzYzhmZTMtZDIzYi00MzZmLWE5MTctMTVlOTBkMWI2NDc4XkEyXkFqcGdeQXVyMjk4MTU1MjM@._V1_SX300.jpg","N/A","7.2",553,"tt1351684","movie","N/A","N/A","N/A","N/A",NA,NA,NA,NA,"7.2/10",NA,NA,2022.365
"Kavi","tt1399573",6,2022-12-31,"Kavi","2009","TV-PG",2010,"19 min","Short, Drama","Gregg Helvey","Gregg Helvey","Sagar Salunkhe, Ulhas Tayade, Rajesh Bàgotra","The story of a young boy who attempts to escape from the brick kiln where he is forced to work as a bonded labor slave in India.","Hindi","United States, India","Nominated for 1 Oscar. 20 wins & 1 nomination total","https://m.media-amazon.com/images/M/MV5BNzE3ZWVmZDQtZDg4Mi00ZDk5LTg5ZjktODU2ZWE5ODk3OGRmXkEyXkFqcGdeQXVyNTM3MDMyMDQ@._V1_SX300.jpg","N/A","6.9",392,"tt1399573","movie","11 Feb 2017","N/A","N/A","N/A",NA,NA,NA,NA,"6.9/10",NA,NA,2022.365
"Miracle Fish","tt1337354",6,2022-12-31,"Miracle Fish","2009","TV-PG",2010,"17 min","Short, Drama","Luke Doolan","Luke Doolan","Karl Beattie, Brendan Donoghue, Angus Russo","8-year-old Joe has a birthday he will never forget. After friends bully him, he sneaks off to the infirmary, wishing everyone in the world would go away. He wakes up to find his dream may have become a reality.","English","Australia","Nominated for 1 Oscar. 12 wins & 1 nomination total","https://m.media-amazon.com/images/M/MV5BMTMwMjEyMTI4MV5BMl5BanBnXkFtZTcwMDE1MTUwMw@@._V1_SX300.jpg","N/A","7.2",914,"tt1337354","movie","06 Jan 2017","N/A","N/A","N/A",NA,NA,NA,NA,"7.2/10",NA,NA,2022.365
"A Hollywood Christmas","tt21950514",5,2022-12-03,"A Hollywood Christmas","2022","PG",2022,"91 min","Comedy, Drama, Romance","Alex Ranarivelo","John Ducey","Jessika Van, Josh Swickard, Anissa Borrego","A successful Christmas movie director begins living her own Christmas movie when a handsome network exec shows up threatening to halt production on her latest film.","English","United States","N/A","https://m.media-amazon.com/images/M/MV5BOTcwNzM3MWEtMjhkMC00YzBjLWFhZDUtODYyZDFhYTEyMDIxXkEyXkFqcGdeQXVyNjk0MTExOQ@@._V1_SX300.jpg","N/A","5.2",NA,"tt21950514","movie","N/A","N/A","N/A","N/A",NA,NA,NA,NA,"5.2/10",NA,NA,2022.337
