"ItemTitle","IMDBid","Rating","Rated.Date","Title","Year","Rated","Released","Runtime","Genre","Director","Writer","Actors","Plot","Language","Country","Awards","Poster","Metascore","imdbRating","imdbVotes","imdbID","Type","DVD","BoxOffice","Production","Website","Internet Movie Database","Rotten Tomatoes","Rated.Year"
"The Red Suitcase","tt22763378",6,2023-02-21,"The Red Suitcase","2022","N/A",2022,"18 min","Short, Drama","Cyrus Neshvad","Guillaume Levil, Cyrus Neshvad","Nawelle Ewad, Sarkaw Gorany, Anne Klein","Luxembourg Airport. Late in the evening. A veiled 16-year-old Iranian girl is frightened to take her red suitcase on the automatic carpet. She keeps pushing back the moment to go through the arrival gate and seems more and more te...","Persian, English, Luxembourgish, French","N/A","Nominated for 1 Oscar. 6 wins & 5 nominations total","https://m.media-amazon.com/images/M/MV5BN2RjNjc3ZmEtYjViMy00N2I3LWFlZjktMzdlMDgyNjA0YjA3XkEyXkFqcGdeQXVyMTA0Mzc3NTI3._V1_SX300.jpg","N/A","7.3",304,"tt22763378","movie","N/A","N/A","N/A","N/A","7.3/10",NA,2023.52
"Le pupille","tt20215392",5,2023-02-21,"Le pupille","2022","PG",2022,"37 min","Short","Alice Rohrwacher","Alice Rohrwacher","Alba Rohrwacher, Greta Zuccheri Montanari, Carmen Pommella","Follow the rebellious girls of a Catholic boarding school before Christmas, a time of war and scarcity.","Italian","Italy, United States","2 wins & 2 nominations","https://m.media-amazon.com/images/M/MV5BNTAwMjI4YWEtZGEwZS00M2Y1LThkYjctOTA5YzAxMWM4M2E3XkEyXkFqcGdeQXVyMTI1NDEyNTM5._V1_SX300.jpg","N/A","7.1",560,"tt20215392","movie","N/A","N/A","N/A","N/A","7.1/10",NA,2023.52
"The Martha Mitchell Effect","tt16379454",7,2023-02-20,"The Martha Mitchell Effect","2022","PG",2022,"40 min","Documentary, Short, History","Anne Alvergue, Debra McClutchy","N/A","Martha Mitchell, Dwight Chapin, Connie Chung","The Cabinet wife who spoke out during Watergate and the Nixon administration's campaign to gaslight her into silence.","English","N/A","2 nominations","https://m.media-amazon.com/images/M/MV5BZjY4ODI3ZTEtMjFmOC00YTQ4LTkwMjYtODgyZGM5Y2Q4NGU5XkEyXkFqcGdeQXVyMjAyNDMwNjY@._V1_SX300.jpg","N/A","6.8",565,"tt16379454","movie","17 Jun 2022","N/A","N/A","N/A","6.8/10","100%",2023.51
"The Elephant Whisperers","tt23628262",6,2023-02-20,"The Elephant Whisperers","2022","PG",2022,"41 min","Documentary, Short","Kartiki Gonsalves","Kartiki Gonsalves, Priscilla Gonsalves, Garima Pura Patiyaalvi","N/A","Bomman and Bellie, a couple in South India, devote their lives to caring for an orphaned baby elephant named Raghu, forging a family like no other that tests the barrier between the human and the animal world.","Tamil","N/A","Nominated for 1 Oscar. 4 nominations total","https://m.media-amazon.com/images/M/MV5BYWQ4ZjE5YjEtN2JkNC00NGExLTkzNDYtMDQ1YTcyZjU1NzY4XkEyXkFqcGdeQXVyMTUyNjc4OTIx._V1_SX300.jpg","N/A","7.3",NA,"tt23628262","movie","N/A","N/A","N/A","N/A","7.3/10",NA,2023.51
"Stranger at the Gate","tt20784118",6,2023-02-20,"Stranger at the Gate","2022","N/A",2022,"29 min","Documentary, Short","Joshua Seftel","N/A","Bibi Bahrami, Saber Bahrami, Zaki Bahrami","A U.S. Marine plots a terrorist attack on a small-town American mosque. His plan takes an unexpected turn when he comes face-to-face with the people he sets out to kill.","English","United States","Nominated for 1 Oscar. 3 wins & 1 nomination total","https://m.media-amazon.com/images/M/MV5BYTFmZjY4NjMtMTlmZS00M2Q5LWFmZGEtZTNhYTBhYjlkNmI0XkEyXkFqcGdeQXVyMjQxNzczMDE@._V1_SX300.jpg","N/A","6.9",402,"tt20784118","movie","N/A","N/A","N/A","N/A","6.9/10",NA,2023.51
"Haulout","tt17162620",7,2023-02-20,"Haulout","2022","N/A",NA,"25 min","Documentary, Short","Maxim Arbugaev, Evgenia Arbugaeva","Maxim Arbugaev, Evgenia Arbugaeva","Maxim Chakilev","Follows a man waiting in his hut in the desolate expanse of the Russian Arctic. He is holding out in order to observe a natural event that occurs here, every year, but ocean warming is taking its toll.","N/A","United Kingdom, Russia","Nominated for 1 Oscar. 6 wins & 7 nominations total","https://m.media-amazon.com/images/M/MV5BNjFhM2NhNWUtOWFlNy00ZDViLWFkZTAtZDI1YmQ2NmUwODJhXkEyXkFqcGdeQXVyMTMxMTIwMTE0._V1_SX300.jpg","N/A","7.1",184,"tt17162620","movie","N/A","N/A","N/A","N/A","7.1/10",NA,2023.51
